{
  "task_id": "COLLAB-019",
  "phase": "acceptance",
  "from_agent": "project-manager",
  "to_agent": "none",
  "summary": "Clarified the Eval Owner vs traceability-manager boundary: Eval Owner owns eval assets, baselines, and verdicts through standardized reports, while traceability-manager only binds those reports into verify and acceptance evidence without defining thresholds or judging pass/fail.",
  "relevant_specs": [
    "governance/policies/eval_governance.policy.md",
    "governance/policies/harness_workflow.policy.md"
  ],
  "evidence_refs": [
    "python3 tools/traceability-cli/traceability_cli.py status --refresh",
    "python3 scripts/check_quality.py --report-json"
  ],
  "blocking_issues": [],
  "recommended_actions": [
    "Archive task when short-term memory can be cleared."
  ]
}
