{
  "task_id": "COLLAB-018",
  "phase": "acceptance",
  "from_agent": "project-manager",
  "to_agent": "none",
  "summary": "Upgraded benchmark-evaluator into an Eval Owner with a new eval governance contract, unified eval CLI/report schema, governed domain manifests for time and PPPAR, and acceptance-ready verdict evidence including blocked PPPAR governance-only outcomes.",
  "relevant_specs": [
    "governance/policies/harness_workflow.policy.md",
    "governance/policies/harness_product_boundary.policy.md",
    "contracts/time_system.contract.md",
    "contracts/ppp_family.contract.md"
  ],
  "evidence_refs": [
    "python3 -m unittest harness.tests.test_agents_runtime tools.tests.test_cli_tools",
    "python3 tools/meson-cli/meson_cli.py eval --domain pppar --report-path /tmp/pppar_eval_report.json --yes",
    "python3 tools/traceability-cli/traceability_cli.py status --refresh",
    "python3 tools/meson-cli/meson_cli.py benchmark --report-path eval/reports/time_benchmark_report.json --yes",
    "python3 scripts/check_quality.py --report-json"
  ],
  "blocking_issues": [],
  "recommended_actions": [
    "Archive task when short-term memory can be cleared."
  ]
}
