{
  "task_id": "COLLAB-020",
  "phase": "acceptance",
  "from_agent": "project-manager",
  "to_agent": "none",
  "summary": "Split product Clause trace from governance compliance by moving governance rules into governance/*.policy.md, tightening traceability-cli to product contracts only, adding a standalone compliance check, and renaming harness/runtime spec fields to affected_specs/allowed_specs/relevant_specs.",
  "relevant_specs": [
    "governance/harness_workflow.policy.md",
    "governance/harness_product_boundary.policy.md",
    "governance/eval_governance.policy.md"
  ],
  "evidence_refs": [
    "python3 -m unittest harness.tests.test_agents_runtime tools.tests.test_cli_tools scripts.tests.test_governance_quality",
    "python3 -m unittest harness.tests.test_harness_cli",
    "python3 tools/traceability-cli/traceability_cli.py status --refresh",
    "python3 tools/traceability-cli/traceability_cli.py compliance --refresh",
    "python3 scripts/render_project_dashboard.py",
    "python3 scripts/check_quality.py --report-json"
  ],
  "blocking_issues": [],
  "recommended_actions": [
    "Archive task when short-term memory can be cleared."
  ]
}
