{
  "task_id": "COLLAB-015",
  "phase": "implementation",
  "from_agent": "project-manager",
  "to_agent": "coding_agent",
  "summary": "project-manager prepared downstream handoff without expert dispatch",
  "relevant_specs": [
    "governance/harness_workflow.policy.md",
    "governance/harness_product_boundary.policy.md"
  ],
  "evidence_refs": [],
  "blocking_issues": [],
  "recommended_actions": [
    "Proceed with implementation against the frozen contracts and current task brief."
  ]
}
