{
  "task_id": "COLLAB-015",
  "phase": "acceptance",
  "from_agent": "project-manager",
  "to_agent": "none",
  "summary": "implemented tracked compact proof retention, compact-runtime, and compacted archive quality gates",
  "relevant_specs": [
    "governance/harness_workflow.policy.md",
    "governance/harness_product_boundary.policy.md"
  ],
  "evidence_refs": [
    "python3 -m unittest discover -s harness/tests -p 'test_*.py'",
    "python3 -m unittest discover -s scripts/tests -p 'test_*.py'",
    "python3 scripts/check_quality.py --report-json --skip-build-test --skip-project-dashboard"
  ],
  "blocking_issues": [],
  "recommended_actions": [
    "Archive task when short-term memory can be cleared."
  ]
}
