{
  "task_id": "COLLAB-023",
  "phase": "acceptance",
  "from_agent": "project-manager",
  "to_agent": "none",
  "summary": "Accepted architecture_freeze artifact support, blueprint lifecycle metadata, active-only decision blueprint loading, and quality-gate enforcement for architecture-expert governance.",
  "relevant_specs": [
    "contracts/layer_boundary.contract.md",
    "governance/policies/harness_workflow.policy.md",
    "governance/policies/harness_product_boundary.policy.md"
  ],
  "evidence_refs": [
    "architecture/blueprints/system/harness-product-boundary.puml",
    "architecture/blueprints/system/harness-product-boundary.md",
    "architecture/blueprints/decisions/architecture-freeze-artifact-lifecycle.puml",
    "architecture/blueprints/decisions/architecture-freeze-artifact-lifecycle.md",
    "python3 -m unittest harness.tests.test_agents_runtime harness.tests.test_harness_cli scripts.tests.test_governance_quality",
    "python3 tools/traceability-cli/traceability_cli.py compliance --refresh",
    "python3 scripts/check_quality.py --report-json"
  ],
  "blocking_issues": [],
  "recommended_actions": [
    "Archive task when short-term memory can be cleared."
  ],
  "architecture_freeze_ref": "harness/runtime/tasks/COLLAB-023/artifacts/architecture_freeze.json"
}
